{
  "schema_version": "1.0.0",
  "deployment_status": "public",
  "feed_url": "./feed.xml",
  "changelog_url": "./CHANGELOG_PUBLIC.md",
  "updates": [
    {
      "id": "update-2026-09-29-mortal-kombat-dont-wake-the-champion-added",
      "object_id": "featured-youtube-trailer",
      "item_id": "mortal-kombat-dont-wake-the-champion",
      "change_type": "created",
      "version": null,
      "updated_at": "2026-09-29T19:56:02Z",
      "summary_en": "Added the owner-supplied Mortal Kombat AI fan trailer to Home Media with full-length local H.264/AAC playback.",
      "summary_ru": "В Home Media добавлен предоставленный владельцем AI fan trailer Mortal Kombat с полноразмерным локальным воспроизведением H.264/AAC.",
      "content_url": "./media/media-index.json",
      "canonical_url": "https://aisflows.com/media/"
    },
    {
      "id": "update-2026-09-29-ghostbusters-first-day-on-the-job-added",
      "object_id": "featured-youtube-trailer",
      "item_id": "ghostbusters-first-day-on-the-job",
      "change_type": "created",
      "version": null,
      "updated_at": "2026-09-29T16:40:33Z",
      "summary_en": "Added the supplied Ghostbusters AI fan trailer to Home Media with local H.264/AAC playback.",
      "summary_ru": "В Home Media добавлен предоставленный AI fan trailer про охотников за привидениями с локальным воспроизведением H.264/AAC.",
      "content_url": "./media/media-index.json",
      "canonical_url": "https://aisflows.com/media/"
    },
    {
      "id": "update-2026-09-29-monster-island-media-replacement",
      "object_id": "featured-youtube-trailer",
      "item_id": "monster-island-mutants",
      "change_type": "updated",
      "version": null,
      "updated_at": "2026-09-29T04:40:09Z",
      "summary_en": "Replaced the first Home Media preview with the owner-supplied Monster Island: Mutants | AI Fan Trailer and its web-ready H.264/AAC derivative.",
      "summary_ru": "Первое превью Media Wall заменено на предоставленный владельцем Monster Island: Mutants | AI Fan Trailer и web-версию H.264/AAC.",
      "content_url": "./media/media-index.json",
      "canonical_url": "https://aisflows.com/media/"
    },
    {
      "id": "update-2026-09-05-course-writer-v1-release",
      "object_id": "course-writer",
      "item_id": "course-writer-v1-zip",
      "change_type": "created",
      "version": "1.0",
      "updated_at": "2026-09-05T00:00:00Z",
      "summary_en": "Added AIS FLOWS Course Writer 1.0 release and its verified public download metadata.",
      "summary_ru": "Добавлен релиз AIS FLOWS Course Writer 1.0 и его подтверждённые публичные метаданные скачивания.",
      "content_url": "https://github.com/aisflows/course-writer/releases/tag/v1.0",
      "canonical_url": "https://github.com/aisflows/course-writer/releases/tag/v1.0"
    },
    {
      "id": "update-2026-08-25-course-current-parity",
      "object_id": "ais-flows-ai-video-course",
      "item_id": null,
      "change_type": "updated",
      "version": "0.2.0-local-rc",
      "updated_at": "2026-08-25T00:00:00Z",
      "summary_en": "Synchronized Home Course metadata with the accepted 24-lesson, 10-track Russian local release candidate; English remains unavailable until a complete package is integrated.",
      "summary_ru": "Метаданные курса Home синхронизированы с принятым русским локальным кандидатом из 24 уроков и 10 разделов; EN остаётся недоступным до интеграции полного пакета.",
      "content_url": "./course/course-content.json",
      "canonical_url": "https://aisflows.com/course/"
    },
    {
      "id": "update-2026-08-09-skill-operations-pack-rc6-released",
      "object_id": "skill-operations-pack",
      "item_id": "v0.1.0-rc6",
      "change_type": "released",
      "version": "0.1.0-rc6",
      "updated_at": "2026-08-09T13:37:52Z",
      "summary_en": "Published AIS FLOWS Skill Operations Pack 0.1.0-rc6 on GitHub with a verified ZIP and SHA256.",
      "summary_ru": "Опубликован AIS FLOWS Skill Operations Pack 0.1.0-rc6 на GitHub с проверенными ZIP и SHA256.",
      "content_url": "https://github.com/aisflows/skill-operations-pack/releases/tag/v0.1.0-rc6",
      "canonical_url": "https://github.com/aisflows/skill-operations-pack/releases/tag/v0.1.0-rc6"
    },
    {
      "id": "update-2026-08-09-media-catalog-routes",
      "object_id": "featured-youtube-trailer",
      "item_id": null,
      "change_type": "updated",
      "version": null,
      "updated_at": "2026-08-09T00:00:00Z",
      "summary_en": "Added canonical EN/RU Media catalog and stable work routes for the five confirmed AIS FLOWS media works.",
      "summary_ru": "Добавлены канонические EN/RU каталоги Media и стабильные маршруты пяти подтверждённых медиаработ AIS FLOWS.",
      "content_url": "./media/media-index.json",
      "canonical_url": "https://aisflows.com/media/"
    },
    {
      "id": "update-2026-08-09-media-wall-revision",
      "object_id": "featured-youtube-trailer",
      "item_id": null,
      "change_type": "updated",
      "version": null,
      "updated_at": "2026-08-09T00:00:00Z",
      "summary_en": "Added four web-safe media works, exact social metadata and a dense curated wall.",
      "summary_ru": "Добавлены четыре web-safe работы, точные социальные ссылки и плотная curated-стена.",
      "content_url": "./media/media-index.json",
      "canonical_url": "https://aisflows.com/media/"
    },
    {
      "id": "update-2026-08-09-skills-catalog-local",
      "object_id": "skill-operations-pack",
      "item_id": null,
      "change_type": "updated",
      "version": "0.1.0-rc6",
      "updated_at": "2026-08-09T00:00:00Z",
      "summary_en": "Added local EN/RU Skills catalogs and one machine-readable Skills index without changing release availability.",
      "summary_ru": "Добавлены локальные EN/RU каталоги Skills и единый машиночитаемый индекс без изменения доступности релизов.",
      "content_url": "./skills/skills-index.json",
      "canonical_url": "https://aisflows.com/skills/"
    },
    {
      "id": "update-2026-08-03-skill-operations-pack-rc6-prepared",
      "object_id": "skill-operations-pack",
      "item_id": null,
      "change_type": "created",
      "version": "0.1.0-rc6",
      "updated_at": "2026-08-03T00:00:00Z",
      "summary_en": "Added AIS FLOWS Skill Operations Pack 0.1.0-rc6 as a prepared local public release candidate without a public download route.",
      "summary_ru": "Добавлен AIS FLOWS Skill Operations Pack 0.1.0-rc6 как подготовленный локальный кандидат публичного релиза без публичного маршрута скачивания.",
      "content_url": null,
      "canonical_url": "https://aisflows.com/#products"
    },
    {
      "id": "update-2026-07-28-home-visual-evidence",
      "object_id": "featured-youtube-trailer",
      "item_id": null,
      "change_type": "updated",
      "version": null,
      "updated_at": "2026-07-28T18:00:00Z",
      "summary_en": "Added factual labels for the four Home media previews and direct EN/RU privacy routes.",
      "summary_ru": "Добавлены фактические подписи четырёх медиапревью Home и прямые EN/RU маршруты privacy.",
      "content_url": null,
      "canonical_url": "https://aisflows.com/#media"
    },
    {
      "id": "update-2026-07-27-public-home-live",
      "object_id": "request",
      "item_id": null,
      "change_type": "updated",
      "version": null,
      "updated_at": "2026-07-27T10:53:18Z",
      "summary_en": "Published AIS FLOWS Home and verified the public Formspree request route, Umami browser events, agent discovery chain, and downloadable artifact integrity.",
      "summary_ru": "Опубликован AIS FLOWS Home; на публичном сайте проверены заявка Formspree, браузерные события Umami, агентный маршрут обнаружения и целостность скачиваемого артефакта.",
      "content_url": "./agent-manifest.json",
      "canonical_url": "https://aisflows.com/"
    },
    {
      "id": "update-2026-07-26-request-analytics-truth",
      "object_id": "request",
      "item_id": null,
      "change_type": "updated",
      "version": null,
      "updated_at": "2026-07-26T16:01:40Z",
      "summary_en": "Recorded the configured Formspree receiver and privacy-safe Umami browser contract as locally accepted, while keeping the Home candidate explicitly not deployed.",
      "summary_ru": "Зафиксированы настроенный Formspree и privacy-safe контракт браузерной аналитики Umami как локально принятые; кандидат Home явно остаётся неразвёрнутым.",
      "content_url": "./request-schema.json",
      "canonical_url": "https://aisflows.com/request/"
    },
    {
      "id": "update-2026-07-22-course-preview",
      "object_id": "ais-flows-ai-video-course",
      "item_id": null,
      "change_type": "created",
      "version": "0.1.0-local-preview",
      "updated_at": "2026-07-22T12:00:00Z",
      "summary_en": "Added a local agent-readable course candidate with direct lesson routes.",
      "summary_ru": "Добавлен локальный агент-читаемый кандидат курса с прямыми маршрутами уроков.",
      "content_url": "./course/course-content.json",
      "canonical_url": "https://aisflows.com/course/"
    },
    {
      "id": "update-2026-07-22-ready-gate-artifact",
      "object_id": "ready-gate",
      "item_id": "ready-gate-rc1-zip",
      "change_type": "updated",
      "version": "v0.1.0-ready-gate-rc1",
      "updated_at": "2026-07-22T12:00:00Z",
      "summary_en": "Verified Ready Gate artifact size and SHA256 for the local candidate.",
      "summary_ru": "Для локального кандидата проверены размер и SHA256 артефакта Ready Gate.",
      "content_url": null,
      "canonical_url": "https://github.com/aisflows/ready-gate/releases/tag/v0.1.0-ready-gate-rc1"
    }
  ]
}
